{
  "id": "research:private-capital",
  "type": "Research",
  "schemaVersion": "2.0",
  "url": "/articles/private-capital.html",
  "status": "PUBLISHED",
  "title": {
    "fa": "سرمایه خصوصی (Private Capital) چیست؟ | راهنمای جامع مفهومی",
    "en": "What Is Private Capital? | A Comprehensive Conceptual Guide"
  },
  "summary": {
    "fa": "راهنمای مفهومی درباره سرمایه خصوصی، دامنه آن و تمایز میان سرمایه‌گذاری خصوصی، اعتبار خصوصی و دارایی‌های واقعی.",
    "en": "A conceptual guide to private capital, its scope, and the distinction between private equity, private credit, and real assets."
  },
  "publication": {
    "datePublished": "2026-08-13T00:00:00+03:30",
    "dateModified": "2026-08-13T00:00:00+03:30",
    "authorRefs": []
  },
  "entityRefs": [
    "concept:private-capital",
    "concept:private-equity",
    "concept:private-credit",
    "concept:real-assets",
    "concept:venture-capital",
    "concept:growth-capital"
  ],
  "claimRefs": [
    "claim:private-capital-broader-than-private-equity",
    "claim:private-capital-includes-private-equity",
    "claim:private-capital-includes-private-credit",
    "claim:private-capital-includes-real-assets",
    "claim:private-capital-includes-venture-capital",
    "claim:private-capital-includes-growth-capital",
    "claim:private-capital-boundaries-vary",
    "claim:private-credit-lender-position",
    "claim:private-credit-return-contractual",
    "claim:private-credit-and-private-equity-linked",
    "claim:real-assets-include-physical-assets",
    "claim:private-capital-private-access"
  ],
  "candidateClaimRefs": [],
  "evidenceRefs": [],
  "sourceRefs": [],
  "relatedResearchRefs": [
    "research:private-equity"
  ],
  "sections": [
    {
      "id": "introduction",
      "claimRefs": [
        "claim:private-capital-broader-than-private-equity",
        "claim:private-capital-includes-private-equity",
        "claim:private-capital-includes-private-credit",
        "claim:private-capital-includes-real-assets"
      ],
      "sourceRefs": [
        "source:ecb-private-markets-public-risk"
      ],
      "title": {
        "fa": "مقدمه",
        "en": "Introduction"
      },
      "content": [
        {
          "id": "intro-paragraph-01",
          "type": "paragraph",
          "text": "«سرمایه خصوصی» (Private Capital)، چتر مفهومی اصلی در حوزه سرمایه‌گذاری و تأمین مالی در بازارهای غیرعمومی است و دامنه آن از سرمایه‌گذاری خصوصی و جسورانه تا بدهی خصوصی و دارایی‌های واقعی را شامل می‌شود. پیدایش و تحول در سرمایه خصوصی، اندازه بازار جهانی، سازوکار خلق ارزش و پیامدهای آن برای اقتصاد ایران از جمله موارد مهمی است که برای درک این مفهوم نیاز است بررسی شود."
        },
        {
          "id": "intro-paragraph-02",
          "type": "paragraph",
          "text": "از آنجا که سرمایه خصوصی (Private Capital) یکی از مفاهیم جامع در حوزه تأمین مالی و سرمایه‌گذاری در اقتصاد مدرن است، این مفهوم دامنه‌ای وسیع‌تر نسبت به «سرمایه‌گذاری خصوصی» (Private Equity) دارد. «سرمایه‌گذاری خصوصی» فقط یکی از اجزای یک اکوسیستم بزرگ‌تر است که شامل «سرمایه‌گذاری خطرپذیر» (Venture Capital)، «اعتبار خصوصی» (Private Credit) و «دارایی‌های واقعی» (Real Assets) نیز می‌شود."
        },
        {
          "id": "intro-figure-01",
          "type": "figure",
          "src": "../assets/images/private-capital.png",
          "alt": "سرمایه خصوصی و ساختار بازارهای خصوصی",
          "caption": ""
        }
      ],
      "mentions": [
        {
          "id": "mention-introduction-private-equity",
          "text": "سرمایه‌گذاری خصوصی",
          "entityRef": "concept:private-equity",
          "contentBlockId": "intro-paragraph-02",
          "start": 151,
          "end": 169,
          "resolutionStatus": "RESOLVED"
        },
        {
          "id": "mention-introduction-private-capital",
          "text": "سرمایه خصوصی",
          "entityRef": "concept:private-capital",
          "contentBlockId": "intro-paragraph-01",
          "start": 1,
          "end": 13,
          "resolutionStatus": "RESOLVED"
        },
        {
          "id": "mention-introduction-real-assets",
          "text": "دارایی‌های واقعی",
          "entityRef": "concept:real-assets",
          "contentBlockId": "intro-paragraph-02",
          "start": 341,
          "end": 357,
          "resolutionStatus": "RESOLVED"
        }
      ]
    },
    {
      "id": "definition-and-scope",
      "claimRefs": [
        "claim:private-capital-private-access"
      ],
      "sourceRefs": [
        "source:ecb-private-markets-public-risk"
      ],
      "title": {
        "fa": "سرمایه خصوصی چیست؟",
        "en": "What Is Private Capital?"
      },
      "content": [
        {
          "id": "definition-subheading-01",
          "type": "subheading",
          "text": "تعریف و دامنه سرمایه خصوصی"
        },
        {
          "id": "definition-paragraph-01",
          "type": "paragraph",
          "text": "سرمایه خصوصی به طیفی از سرمایه‌گذاری‌ها و تأمین مالی‌هایی میان سرمایه‌گذاران و مالکان دارایی‌ها یا بنگاه‌هایی اشاره دارد که به‌طور معمول خارج از بازارهای عمومی انجام می‌شود. در این چارچوب، «خصوصی» به معنای عدم معامله عمومی ابزار یا دارایی در زمان سرمایه‌گذاری است، نه لزوماً مالکیت خصوصی به معنای حقوقی آن. به همین دلیل، یک شرکت خصوصی، یک پروژه زیرساختی، یک وام مستقیم به بنگاه یا یک سرمایه‌گذاری در دارایی واقعی می‌تواند در قلمرو «سرمایه خصوصی» قرار گیرد."
        },
        {
          "id": "definition-paragraph-02",
          "type": "paragraph",
          "text": "بانک مرکزی اروپا نیز بازارهای خصوصی را دربرگیرنده سه گروه اصلی «سرمایه‌گذاری خصوصی» (Private Equity)، «اعتبار خصوصی» (Private Credit) و «دارایی‌های واقعی» (Real Assets) معرفی می‌کند."
        },
        {
          "id": "definition-paragraph-03",
          "type": "paragraph",
          "text": "از نظر ساختار بازار، «سرمایه خصوصی» را باید از زیرمجموعه‌هایش متمایز کرد تا بتوان بدهی خصوصی، زیرساخت، املاک، منابع طبیعی، سرمایه‌گذاری جسورانه و دیگر استراتژی‌های غیرعمومی را در یک چارچوب مفهومی یکسان تحلیل کرد."
        },
        {
          "id": "definition-figure-01",
          "type": "figure",
          "src": "../assets/images/2026-08-13-private-capital-structure.png.png",
          "alt": "شکل ۱ — هدایت منابع مالی توسط صندوق‌های بازارهای خصوصی",
          "caption": "شکل ۱ — هدایت منابع مالی توسط صندوق‌های بازارهای خصوصی"
        }
      ]
    },
    {
      "id": "main-blocks",
      "claimRefs": [
        "claim:private-capital-includes-private-equity",
        "claim:private-capital-includes-private-credit",
        "claim:private-capital-includes-real-assets",
        "claim:private-capital-includes-venture-capital",
        "claim:private-capital-includes-growth-capital",
        "claim:private-capital-boundaries-vary"
      ],
      "sourceRefs": [
        "source:ecb-private-markets-public-risk"
      ],
      "mentions": [
        {
          "id": "mention-main-blocks-venture-capital",
          "text": "سرمایه‌گذاری خطرپذیر",
          "entityRef": "concept:venture-capital",
          "contentBlockId": "main-blocks-paragraph-01",
          "start": 96,
          "end": 116,
          "resolutionStatus": "RESOLVED"
        },
        {
          "id": "mention-main-blocks-growth-capital",
          "text": "سرمایه رشد",
          "entityRef": "concept:growth-capital",
          "contentBlockId": "main-blocks-paragraph-01",
          "start": 120,
          "end": 130,
          "resolutionStatus": "RESOLVED"
        },
        {
          "id": "mention-main-blocks-private-credit",
          "text": "اعتبار خصوصی",
          "entityRef": "concept:private-credit",
          "contentBlockId": "main-blocks-paragraph-01",
          "start": 134,
          "end": 146,
          "resolutionStatus": "RESOLVED"
        }
      ],
      "title": {
        "fa": "بلوک‌های اصلی سرمایه خصوصی",
        "en": "Main Blocks of Private Capital"
      },
      "content": [
        {
          "id": "main-blocks-paragraph-01",
          "type": "paragraph",
          "text": "در یک طبقه‌بندی عملیاتی، «سرمایه خصوصی» را می‌توان در پنج بلوک اصلی دید: «سرمایه‌گذاری خصوصی»، «سرمایه‌گذاری خطرپذیر»، «سرمایه رشد»، «اعتبار خصوصی» و «دارایی‌های واقعی». مرزبندی دقیق میان این بلوک‌ها در منابع مختلف یکسان نیست و برخی منابع، از جمله در موضوع «اعتبار خصوصی»، دامنه متفاوتی از وام‌دهی مستقیم تا اعتبارات مبتنی بر دارایی را در گزارش‌های خود منظور می‌کنند."
        }
      ]
    },
    {
      "id": "private-equity",
      "title": {
        "fa": "سرمایه‌گذاری خصوصی (Private Equity)",
        "en": "Private Equity"
      },
      "content": [
        {
          "id": "private-equity-subheading-01",
          "type": "subheading",
          "text": "سرمایه‌گذاری خصوصی (Private Equity)"
        },
        {
          "id": "private-equity-paragraph-01",
          "type": "paragraph",
          "text": "این مفهوم به سرمایه‌گذاری در حقوق صاحبان سهام شرکت‌های غیربورسی اشاره دارد و در ادبیات حرفه‌ای، استراتژی‌هایی مانند خرید اهرمی (Buyout)، سرمایه‌گذاری خطرپذیر، سرمایه رشد، بازسازی و احیای شرکت (Turnaround) و سرمایه‌گذاری در شرکت‌های دچار بحران (Distressed) را دربرمی‌گیرد."
        },
        {
          "id": "private-equity-paragraph-02",
          "type": "paragraph",
          "text": "در «سرمایه‌گذاری خطرپذیر»، تمرکز بیشتر بر بنگاه‌های جوان‌تر، نوآور و دارای ظرفیت رشد بالا است که به دلیل عدم قطعیت و ریسک عملیاتی و تجاری بیشتر، با محدودیت دسترسی به منابع مالی متعارف مواجه‌اند."
        },
        {
          "id": "private-equity-paragraph-03",
          "type": "paragraph",
          "text": "در مقابل، «سرمایه رشد» نسبتاً برای تأمین مالی توسعه و گسترش بنگاه‌های بالغ به کار گرفته می‌شود و لزوماً مستلزم تملک کامل یا کسب کنترل شرکت نیست."
        },
        {
          "id": "private-equity-paragraph-04",
          "type": "paragraph",